{
  "app_name": "my-app",
  "app_version": "0.1.0",
  "owner": "my-org",
  "repo": "my-app",
  "tag": "v{app_version}",
  "base_urls": ["https://github.com/{owner}/{repo}/releases/download/{tag}"],
  "hosting": {
    "github": {
      "artifact_download_path": "/{owner}/{repo}/releases/download/{tag}"
    }
  },
  "windows_archive": {
    "style": ".zip",
    "layout": "flat"
  },
  "unix_archive": {
    "style": ".tar.gz",
    "layout": "wrapped"
  },
  "executables": ["my-app"],
  "cdylibs": [],
  "cstaticlibs": [],
  "min_glibc_version": "2.17",
  "checksum_style": "sha256",
  "bin_aliases": {},
  "install_paths": ["~/.local/bin"],
  "install_success_msg": "my-app was successfully installed!",
  "platform_support": {
    "archives": [
      {
        "id": "my-app-{app_version}-x86_64-unknown-linux-gnu.tar.gz",
        "target_triple": "x86_64-unknown-linux-gnu",
        "checksum": "0000000000000000000000000000000000000000000000000000000000000000"
      }
    ]
  }
}
